"PairTested","RelDiff","DeltaAIC","p_value"
"Parasite vs Host",1.20418492132952,0.168402380380257,0.175938959129826
"Psittacanthus robustus vs Vochysia thyrsoidea",0.86746890257819,-4.2900163064557,0.0121419934367274
"Phoradendron perrotettii vs Tapirira guianensis",1.06670651414045,0.860990332299139,0.285861686990242
"Struthanthus rhynchophyllus vs Tipuana tipu",1.19084814661445,-2.72515505655143,0.0297245031618068
"Viscum album vs Populus nigra",2.36805739660394,-16.4248947230372,1.76733893431289e-05
